{
  "$schema": "http://json-schema.org/draft-07/schema#",
  "additionalProperties": false,
  "required": ["title", "basemap"],
  "type": "object",
  "properties": {
    "title": {
      "type": "string"
    },
    "planmap_id": {
      "type": "string"
    },
    "publication": {
      "type": "string"
    },
    "authors": {
      "type": "string"
    },
    "basemap": {
      "type": "object",
      "properties": {
        "url": {
          "type": "string",
          "minLength": 10
        },
        "options": {
          "type": "object",
          "properties": {
            "crs": {
              "type": "string",
              "enum": ["EPSG3857"]
            },
            "maxNativeZoom": {
              "type": "integer"
            },
            "tms": {
              "type": "boolean"
            },
            "autoZIndex": {
              "type": "boolean"
            },
            "attribution": {
              "type": "string"
            }
          }
        }
      }
    },
    "chapters": {
      "type": "array",
      "items": {
        "type": "object",
        "properties": {
          "order": {
            "type": "integer"
          },
          "steps": {
            "type": "array",
            "items": {
              "type": "object",
              "properties": {
                "title": {
                  "type": "string"
                },
                "text": {
                  "type": "string"
                },
                "stoptime": {
                  "type": "integer"
                },
                "layers": {
                  "type": "array",
                  "items": {
                    "type": "object",
                    "properties": {
                      "order": {
                        "type": "integer"
                      },
                      "credits": {
                        "type": "string"
                      },
                      "path": {
                        "type": "string"
                      },
                      "owstype": {
                        "type": "string",
                        "enum": ["wms", "wfs"]
                      }
                    }
                  }
                },
                "media": {
                  "type": "array",
                  "items": {
                    "type": "object",
                    "properties": {
                      "path": {
                        "type": "string"
                      },
                      "mimetype": {
                        "type": "string",
                        "enum": ["video/youtube", "image/png", "model/gltf-binary"]
                      },
                      "caption": {
                        "type": "string"
                      }
                    }
                  }
                },
                "view": {
                  "type": "object",
                  "properties": {
                    "extent": {
                      "type": "array",
                      "minItems": 4,
                      "maxItems": 4,
                      "items": [
                        {
                          "type": "number",
                          "minimum": -180,
                          "maximum": 180
                        },
                        {
                          "type": "number",
                          "minimum": -90,
                          "maximum": 90
                        },
                        {
                          "type": "number",
                          "minimum": -180,
                          "maximum": 180
                        },
                        {
                          "type": "number",
                          "minimum": -90,
                          "maximum": 90
                        }
                      ]
                    },
                    "marker": {
                      "type": "array",
                      "items": [
                        {
                          "type": "number",
                          "minimum": -180,
                          "maximum": 180,
                          "exclusiveMinimum": true,
                          "exclusiveMaximum": true
                        },
                        {
                          "type": "number",
                          "minimum": -90,
                          "maximum": 90,
                          "exclusiveMinimum": true,
                          "exclusiveMaximum": true
                        }
                      ]
                    }
                  }
                }
              }
            }
          }
        }
      }
    }
  }
}
